code	City	Company_Name	Main_Activity	Operating_Revenue	Total_Assets	Revenue_Range	No_of_Companies	Shareholder_Name	Shareholder_Country	CEO_Name
EC1791957261001	Quito	Indutap Cia. Ltda.	Services	3046	0	1752	0
EC1790828573001	Puerto Ayora	Iguanatours, Cruceros Maritimos S.A.	Services	3035	0	1752	0	Mr Eduardo Javier Diez Gangotena, Mr Francisco Eduardo Diez Gangotena, Mr Jose Diez Gangotena Fernando	EC
EC1791315588001	Quito	Sabre International, Llc.	Services	3008	0	1752	0
EC0991407723001	Guayaquil	Celmarket S.A.	Services	3003	0	1752	2	Mr Mariano Erazo Valverde Jofre, Mr Monserrate Manuel Ernesto Rangel	EC
EC0591719084001	Latacunga	Holguer Medina El Maestro Ferreteria Cia. Ltda.	Services	2985	0	1752	0
EC1790007227001	Quito	Ecuadorian Tours Agencia De Viajes Y Turismo Sa	Services	2955	0	1752	0	Herederos Teran Venegas Cecil Emerson, Mr Alvaro Iturralde Moncayo, Mr Diego Fernando Teran Moeller, Mr Fuad Alberto Dassum Armendariz, Mr Gustavo Teran Moller Cecil, Mr Roberto Bolivar Teran Moeller	EC
EC15905	Springfield	Cooperativa De Ahorro Y Credito Guaranda Ltda	Services	2948	36682	1752	0
EC1792185483001	Quito	Belech Fire & Rescue Cia. Ltda.	Services	2944	0	1752	2	Mr Christopher Robert Lechler Argudo, Mrs Elsie Teresa Argudo Maldonado	EC,US
EC0992781505001	Guayaquil	Importadora Comercial Leon S.A. Imcomleosa	Services	2936	0	1752	0	Mr Alejandro Molina Leon Milton, Mr Hernan Molina Leon Edison, Mr Ivan Ricardo Molina Leon, Mrs Esperanza Angelica Leon Rivas	EC
EC1791333152001	Quito	Redpartner S.A.	Services	2930	0	1752	2	Mr Ignacio Cabarique Serrano Martin, Mr Luis Adriano Calero Peralta, Mrs Lina Maria Forero Velasco	CO,EC
EC1792343518001	Quito	Textilcardiz Cia. Ltda.	Services	2912	0	1752	2	Mrs Carolina Viteri Diaz, Mrs Gloria Milena Diaz	CO,EC
EC0990864802001	Guayaquil	Consorsan Constructora Ordonez & Sanmartin C. Ltda	Services	2909	0	1752	0
EC0992783265001	Guayaquil	Importadora Ferreteria Molina S.A. Imfermosa	Services	2896	0	1752	0	Mr Alejandro Molina Leon Milton, Mr Hernan Molina Leon Edison, Mr Ivan Ricardo Molina Leon, Mr Ricardo Molina Molina Froilan	EC
EC20720	Quito	Caja Central Financoop	Services	2852	107266	1752	0
EC53505	Quito	Cooperativa De Ahorro Y Credito Cotocollao Ltda	Services	2820	23179	1752	0
EC1792040825001	Quito	Ciscosystems Ecuador S.A.	Services	2819	0	1752	537	Cisco Systems Inc	US
EC1792090121001	Machachi	Ferreteria El Caracol Ferrecaracol Cia. Ltda.	Services	2806	0	1752	0
EC1791710576001	Quito	Creaciones Dap S.A.	Services	2793	0	1752	0
EC0992854812001	Guayaquil	Mitancy S.A.	Services	2776	0	1752	0
EC0992543671001	Guayaquil	Comercial Jenny Iturralde Arrobo Jenitu S.A.	Services	2770	0	1752	0	Mr Miguel Angel Jara Iturralde, Mrs Ana Belen Jara Iturralde	EC
EC1792357446001	Nueva Loja	Nutrijama S.A.	Services	2769	0	1752	2	Mr Jose Aristides Intriago Quiroz, Mr Marcos Aristides Intriago Cuenca	EC
EC1792094593001	Quito	Unosystems S.A.	Services	2760	0	1752	2	Integra2, Llc, Todo1 Services Inc	US
EC1792011523001	Quito	Salumed S.A.	Services	2756	0	1752	2	Mr Bruno Esteban Ullauri Paredes, Mr Jose Antonio Andrade Paredes	EC
EC1792241936001	Quito	Consorcio Stereocarto - Aeromapa	Services	2744	0	1752	0
EC1791886712001	Quito	Temenos Ecuador S.A	Services	2743	0	1752	116	Temenos Group Ag	CH
EC1791252322001	Quito	Level 3 Ecuador Lvlt S.A.	Services	2718	0	1752	302	Gc Impsat Holdings I Limited, Gc Impsat Holdings Ii Limited, Level 3 Communications, Inc.	GB,US
EC2090004274001	Puerto Ayora	Servicios Turisticos Galextur Cia. Ltda.	Services	2716	0	1752	0	Mr Gabriele Silberstein, Mr Kurt Silberstein Werner	DE
EC0990018707001	Guayaquil	Ecuaquimica Ecuatoriana De Productos Quimicos Ca	Services	2694	0	1752	5	Avtschar Ag, Chasquis Holding Ag, Fideicomiso Cef, Mamema Ag, Mrs Regula De Von Tscharner, Quito Holding Ag	CH,EC
EC30129LE	Quito	Corporacion Civil Bolsa De Valores De Quito	Services	2662	5812	1752	0
EC1792394805001	Quito	Inbuseretp S.A.	Services	2657	0	1752	0
EC0992448334001	Puerto Ayora	Galapacific S.A.	Services	2652	0	1752	0
EC0990917302001	Guayaquil	Turismo Amonra S.A.	Services	2649	6764	1752	4	Ecoventura S.A., Opergal S.A.	EC
EC0990011524001	Duran	Compania Recubridora De Papel S.A.	Services	2644	3723	1752	2	Mr Daniel Lebed Svigilsky, Mr Rene Lebed Svigilsky, Mrs Myriam Lebed Svigilsky, Ospa Muller Lily	EC
EC1792256674001	Quito	Jcr Distribution Services Cia. Ltda.	Services	2637	0	1752	0
EC0990023220001	Quito	Coats Cadena S.A.	Services	2628	0	1752	271	Coats South America Holdings B.V., Valera Nabanete Gilmar	NL,BR
EC1791831470001	Quito	Service.Com S.A	Services	2613	0	1752	0
EC54340	Calceta	Cooperativa Ahorro Y Credito Calceta Ltda	Services	2596	19723	1752	0
EC0990981930001	Guayaquil	Banco Del Litoral	Services	2580	21488	1752	0	Franciscojavierde La Rosamaura, Inmoalta Inmobiliaria Altavista Sociedad Anonima Civil, Marivisol S.A, Mr Aldo Maluk Salem Omar, Mr Angel Benigno Bravo Ordonez, Mr Carlos Luis Quinones Velasquez, Mr Eduardo Alejandro Ceballos Santos, Mr Eduardo Hugo Salcedo Gonzaga, Mr Francisco Alberto Falcon Perez, Mr Fuad Alberto Dassum Armendariz, Mr Harry Bernardo Shephard Blanco, Mr Hernan Francisco Illingworth Vernaza, Mr Ignacio Villacis Crespo Diogenes, Mr Jacinto Alcides Posligua Galarza, Mr Joaquin David Aviles Zuniga, Mr Jorge Eduardo Encalada Mora, Mr Jose Manuel Honores Plaza, Mr Jose Miguel Aguilar Mora, Mr Luis Alberto Chiriboga Parra, Mr Luis Felipe Vayas Monroy, Mr Luis Rafael Caputi Campodonico, Mr Magaly Del Rocio Merchan, Mr Mariano Ortega Cabeza De Vaca, Mr Oswaldo Monroy Palau Abdon, Mr Rafael Antonio Pino Rubira, Mr Raul Alejandro Arosemena Barahona, Mr Tomas Eduardo Zurita Guerrero, Mr Walter Beckmann Farfan Jack, Mrs Aracely Morales Yagual Rosario, Mrs Flor Freire Hernandez Bella, Mrs Nancy Elizabeth Real Campodonico, Mrs Nora Estelia Chavez Mieles, Mrs Rosalia Lopez Sarmiento, Mrs Ruth Ulloa Cedeno, Mrs Sonia Patricia Vera Chalen, Noboa Azin Johnsebastian Maximiliam, Tamanapolis S.A	EC
EC1791414101001	Guayaquil	Itelbas Ingenieria Telecomunicaciones Benavides Abad Servicios Cia. Ltda.	Services	2546	0	1752	2	Mr Humberto Benavides Montenegro Fabian, Mr Manuel Fernando Betancourt Revelo, Mrs Cristina Lorena Benavides Montenegro	EC
EC1791836952001	Quito	Icap Del Ecuador S.A	Services	2542	0	1752	249	Icap Plc	GB
EC0992757264001	Guayaquil	Servifactible S.A.	Services	2541	0	1752	0
EC1791334027001	Quito	Equipos De Vigilancia Y Control Evigisa S.A.	Services	2538	0	1752	0	Mr Marcelo Antonio Calvopina Herrera, Mrs Ana Lucia Arico Espin	EC
EC0990841993001	Guayaquil	Agencia Maritima Global Marglobal Sa	Services	2523	0	1752	0
EC0991352333001	Guayaquil	Dsv-Gl Ecuador S.A.	Services	2521	0	1752	2	Agencia Del Pacifico Delpac S.A., Mrs Fanny Elena Mancilla Henriquez	EC
EC0992662743001	Guayaquil	Consesorial S.A.	Services	2517	0	1752	2	Mr Pablo Adolfo Alvarez Mora, Mrs Angelica Roxanna Alvarez Loor	EC
EC0992408421001	Guayaquil	Tobamac S.A.	Services	2516	0	1752	2	Gonzalez Mora Piedad De Jesus, Mr Alberto Eduardo Galarza Naranjo, Mr Christian Omar Galarza Gonzalez, Mr Gary Gabriel Galarza Gonzalez, Mr Hugo Alberto Galarza Gonzalez, Mr Jimmy Eduardo Galarza Gonzalez	EC
EC0991344829001	Quito	Amadeusglobal Ecuador S.A.	Services	2484	0	1752	0
EC0992354119001	Puerto Ayora	Pacific Marine Enterprises Cia. Ltda. Pamarent	Services	2478	0	1752	0
EC1791786181001	Quito	Cooper Gay Ecuador C.A.	Services	2475	0	1752	0
EC1792269644001	Quito	Point Technical Soluciones Cia. Ltda.	Services	2466	0	1752	0	Guerrero Carbo Klever Estuardo, Mr Edwin Fabian Guallichico Escobar, Mr Vinicio Pinto Espinosa	EC
EC0992113502001	Guayaquil	Asuncorp S.A.	Services	2458	0	1752	0
EC0992646764001	Guayaquil	Control Total S.A. Controtalsa	Services	2446	0	1752	0	Mr Arie Shalev Abramowicz, Mr Roberto Posas Pineda	HN,UY
EC1791730216001	Quito	Xafel S.A	Services	2435	0	1752	2	Mr Xavier Egues Ponce, Mrs Laura Maria Egues Rios	EC
EC1791752732001	Quito	Medicorsa Cia. Ltda	Services	2430	0	1752	0
EC1792512409001	Quito	Epsodecua Cia. Ltda.	Services	2417	0	1752	0
EC0992854790001	Guayaquil	Boxeves S.A.	Services	2415	0	1752	0
EC0990364451001	Guayaquil	Compania De Desarrollo Bananero Del Ecuador Bandecua Sa	Services	2409	0	1752	18	Del Monte Fresh Produce International Inc., Del Monte Fresh Produce N.A., Inc.	LR,US
EC0991415548001	Quito	Bauer & Co. S.A.	Services	2391	0	1752	2	Mr Ricardo Joaquin Kling, Richcoast Corp	CA,PA
EC1792228697001	Quito	Oc Arquitectos Constructores Arquihome Cia. Ltda.	Services	2376	0	1752	0
EC0992759682001	Guayaquil	B Telecomunicaciones Latino America S.A. Btelasa	Services	2374	0	1752	0
EC1791334477001	Quito	Dhl Global Forwarding (Ecuador) S.A.	Services	2370	0	1752	1016	Deutsche Post Ag	DE
EC1792231167001	Quito	Carpintex R&D Cia. Ltda.	Services	2369	0	1752	2	Mr Francisco Campoverde Vargas Darwin, Mr Taco Roberto Carlos Montenegro	EC
EC0992557168001	Guayaquil	Ghiberty S.A.	Services	2369	0	1752	2	Mr Alfredo Armando Salazar Villegas, Mr Luis Fernando Rivadeneira Salazar	EC
EC0992383429001	Guayaquil	Servicios Graficos Serflexcorp S.A.	Services	2360	0	1752	0	Mr Tomas Augusto Rivas Agurto, Mr Victor Hugo Garcia Martinez	EC
EC1191717011001	Cariamanga	Distribuidora Carrasco - Davila Cia. Ltda.	Services	2357	0	1752	0
EC0992826444001	Guayaquil	Klinnas S.A.	Services	2351	0	1752	0
EC1790820777001	Quito	Latintour Cia.Ltda.	Services	2334	0	1752	0
EC0991458050001	Guayaquil	Global Interactions S.A. Globinter	Services	2332	0	1752	0
EC0992789204001	Guayaquil	Senih Telecomunicaciones S.A. Telsenihsa	Services	2322	0	1752	0
EC20733	Guayaquil	Sociedad Financiera Leasingcorp S.A.	Services	2308	23362	1752	0
EC0992382929001	Milagro	Fargen S.A.	Services	2304	0	1752	2	Fideicomiso Garantia Fargentrust, Mr Guillermo Fabio Guevara Naranjo	EC
EC0991495614001	Eloy Alfaro	Ceym, Compania Electrica Y Mecanica S.A.	Services	2296	0	1752	2	Mr Jose Juan Collado Acevedo, Mr Juan Antonio Zuniga Briones, Mr Juan Antonio Zuniga Fajardo, Mrs Erika Alexandra Zuniga Fajardo	EC
EC1791930320001	Santo Domingo	Compania De Proteccion Y Vigilancia Comprovig Cia. Ltda.	Services	2285	0	1752	0
EC0991268499001	Guayaquil	Seguros Colon Sa	Services	2272	9945	1752	2	Disenos Y Proyectos S.A. Condesign, Mr Gianni Adriano Garibaldi Uraga, Mr Jose Gabriel Martinez Castro, Mrs Adriana Gisella Garibaldi Carvajal, Mrs Maria Soledad Uraga Wagner	EC
EC0991364277001	Guayaquil	Blasti S.A.	Services	2270	0	1752	0	Blasti S.A.	EC
EC0992696087001	Daule	Ferregama S.A.	Services	2269	0	1752	0
EC0991076395001	Guayaquil	Galascuba S.A.	Services	2267	0	1752	0
EC1792171946001	Quito	Expressgrill Cia. Ltda.	Services	2266	0	1752	2	Mr Jaime Francisco Droira Gonzalez, Mr Jaime Tarcisio Droira Canelos, Mrs Gladys Raquel Landeta Pozo	EC
EC1790842436001	Quito	Georama S.A.	Services	2265	0	1752	0
EC0992355581001	Guayaquil	Imtelsa S.A.	Services	2265	0	1752	0	Mr Nicolas Robalino Amado Andres, Mrs Nicole Margoth Robalino Amado	EC
EC1791816471001	Santo Domingo	Comercial Arwalic S.A	Services	2263	0	1752	0	Mr Julio Modesto Campoverde Vidal, Romero Vargas Carmita Esterfilia	EC
EC0992717432001	Guayaquil	Fj Servindustria Cia. Ltda.	Services	2248	0	1752	0
EC1792113415001	Quito	Ferreteria Orbea -Ferreorb- Cia. Ltda.	Services	2244	0	1752	2	Mr Guillermo Orbea Orbea Galo, Mrs Maria Jose Orbea Arias	EC
EC1791242327001	Quito	Fabridor Fabricato Del Ecuador S.A.	Services	2202	0	1752	0
EC0992537388001	Guayaquil	Asempublicorp S.A.	Services	2187	0	1752	0
EC1791314085001	Quito	Comercializadora Y Servicios Bodstrom Cia. Ltda.	Services	2185	0	1752	0	Mr Diego Madrinan Guayasamin, Mr Eduardo Madrinan Romo Leroux Manuel, Mr Luis Alberto Alvarez Muina, Mrs Maria Eulalia Monteverde Paz	CU,EC
EC0591725033001	Latacunga	Construcciones Mecanicas Alban Cia. Ltda.	Services	2181	0	1752	0
EC0992505338001	Guayaquil	Bonudiem S.A.	Services	2151	0	1752	0
EC0992123052001	Guayaquil	Constructora Cribeca S.A.	Services	2151	0	1752	0
EC0992156651001	Guayaquil	Supermercado San Mateo Supersanma S.A.	Services	2140	0	1752	0	Mr Christiam Fabricio Gonzalez Tobar, Mr Rafael Alocen Oliva Mariano, Mr Rafael Enrique Alocen Tobar, Mrs Elza Graciela Tobar Hidalgo, Mrs Vanessa Cristina Alocen Tobar	ES,EC
EC0992488565001	Guayaquil	Constructora Ecuatoriana S.A. Construriana	Services	2132	0	1752	0
EC0992651792001	Guayaquil	Comercio Y Otros S.A. Comercotrosa	Services	2129	0	1752	0
EC0691711358001	Riobamba	Constructora Fabypal Cia. Ltda.	Services	2126	0	1752	0
EC0991453369001	Guayaquil	Mendez Y Asociados Asomen S.A.	Services	2111	0	1752	2	Mr Carlos Nicanor Mendez Sicha, Mr Flavio Agustin Mendez Sicha, Mr Segundo Cecilio Mendez Yunda, Mrs Carmen Marlene Herrera Veintimilla, Mrs Maria Emperatriz Mendez Sicha, Mrs Mercedes Salome Mendez Sicha	EC
EC0992186518001	Guayaquil	Novitat S.A.	Services	2106	0	1752	0	Mr Freddy Jarrin Gonzaga Haldo, Mrs Yuliana Maria Auad Saab De Jarrin	EC
EC0992653647001	Guayaquil	Asempreser, Servicios Y Asesoria Empresarial S.A.	Services	2105	0	1752	0
EC0991295186001	Guayaquil	Donut House S.A.	Services	2083	0	1752	0
EC54341	Guayaquil	Global Sociedad Financiera Sa	Services	2074	25625	1752	0
EC0992654007001	Guayaquil	Publicidad, Marketing Y Servicios S.A. Pumarkserv	Services	2056	0	1752	0
EC0992741597001	Guayaquil	Gibelar S.A.	Services	2055	0	1752	0
EC1792142520001	Pifo	Cenferza Cia. Ltda.	Services	2052	0	1752	2	Mr Cristhian Danilo Zarate Mora, Mr Patricio Zarate Mora Byron, Mr Segundo Jose Miguel Zarate Bolanos	EC
EC0992537345001	Guayaquil	Medyservicon S.A.	Services	2046	0	1752	0
EC0991374752001	Guayaquil	Oilcorp S.A.	Services	2028	0	1752	0
EC0992709464001	Daule	Superproximo Cia. Ltda.	Services	2024	0	1752	0	Mr Juan Carlos Mesa Gonzalez, Mrs Angela Maria Mesa Gonzalez, Mrs Magda Lucia Gonzalez Rodriguez	CO,EC
EC0992662794001	Guayaquil	Servicical S.A.	Services	2022	0	1752	0
EC0992852178001	Guayaquil	Karpolin S.A.	Services	2015	0	1752	0
EC1391746377001	Quevedo	Importadora Madoba S.A.	Services	2000	0	1752	2	Mr Cristhian Fabian Donoso Bejarano, Mr Mario Gualberto Donoso Barriga, Mrs Maria Jose Donoso Bejarano	EC
EC1391791070001	Manta	Proyectos Alternativos S.A. Proalto	Services	2000	0	1752	0	Mr Jose Antonio Martinez Murillo, Mr Juan Javier Perez Gavilanes	EC,ES
EC0992664258001	Guayaquil	Mercapublisa Mercado Y Publicidad S.A.	Services	1998	0	1752	0
EC0991288945001	Guayaquil	Felvenza S.A.	Services	1992	0	1752	0
EC1791898044001	Guayaquil	Lan Peru S.A.	Services	1989	0	1752	0
EC0992690674001	Guayaquil	Sailorpaint S.A.	Services	1981	0	1752	0
EC1291710650001	Quevedo	Multipartes S.A.	Services	1967	0	1752	2	Mr Anibal Fon Fay Vasquez Walter, Mr Antonio Fon Fay Vasquez Yen King, Mr Norma Del Rocio Fon Fay Vasquez, Mrs Aminta Fon Fay Vasquez Joba, Mrs Flor Marina Fon Fay Vasquez, Mrs Norma Vasquez Rodriguez	EC
EC0991356193001	Guayaquil	Bananapuerto Puerto Bananero S.A.	Services	1963	0	1752	137	Dole Food Company, Inc.	US
EC0992537124001	Guayaquil	Publicicon S.A.	Services	1962	0	1752	0
EC1091740342001	Ibarra	Premiertel S.A.	Services	1949	0	1752	0
EC1790173984001	Quito	Ital-Llanta C Ltda	Services	1947	0	1752	0
EC1791715780001	Quito	Tripoint S.A.	Services	1943	0	1752	0	Mr Francisco Stalin Garces Reyes, Mr Heriberto Rojas Hernandez, Mrs Gladys Eulalia Magdalena Cortes Cortez	EC
EC0992252146001	Guayaquil	Ecuador Broadcast Corporation S.A. Ebca	Services	1938	0	1752	0
EC0992651776001	Guayaquil	Medisermas S.A. Medicinas, Servicios Y Mas	Services	1914	0	1752	0
EC0992488964001	Guayaquil	Transmar Ecuador S.A.	Wholesale	1911	0	1752	2	Morristown Group Llc, Mr Johnson Timothy Banks, Mr Peter Gustave Johnson	US
EC1792096332001	Quito	Perishairport Cia. Ltda.	Wholesale	1909	0	1752	0
EC1792403367001	Quito	Masmovilec Modelos Interactivos Cia. Ltda.	Wholesale	1900	0	1752	0
EC0992645504001	Guayaquil	Baco Internacional S.A. Bacointersa	Wholesale	1898	0	1752	0
EC1791902947001	Quito	Casemager Compania De Seguridad Maria Gerarda, Cia. Ltda.	Wholesale	1891	0	1752	0
EC1792296404001	Quito	Origenlight Cia. Ltda.	Wholesale	1891	0	1752	0
EC0992616431001	Guayaquil	Dapris Fashion S.A.	Wholesale	1888	0	1752	0
EC0992426829001	Guayaquil	Pacificlogistic S.A.	Wholesale	1888	0	1752	2	Mr Alfredo Palacios Echeverria Lester, Mr Vera Washington Iturralde	EC
EC1792202728001	Quito	Decortelas Cia. Ltda.	Wholesale	1886	0	1752	0
EC0992139269001	Guayaquil	Thermocont S.A.	Wholesale	1884	0	1752	2	Mr Alex Giovanny Bustamante Rivera, Mrs Jaime Maria Elena Mendoza	EC
EC0990369445001	Guayaquil	Remar Representaciones Maritimas Del Ecuador Sa Remar	Wholesale	1871	0	1752	104	Ultramar Network	CL
EC1792031222001	Quito	Textiles Antonio Aguayo Cia. Ltda.	Wholesale	1864	0	1752	0
EC0992824743001	Guayaquil	Voondu S.A.	Wholesale	1847	0	1752	0
EC0990529477001	Guayaquil	Diselmaq Cia Ltda	Wholesale	1846	0	1752	2	Mr Carlos Roberto Morales Navas, Mrs Elvia Maria Guevara, Mrs Lorena Guevara Guevara Lucciana, Mrs Mercedes Angelica Navas Saenz, Mrs Roxana Sabina Guevara Guevara	EC
EC53533	Guayaquil	Financiera De La Republica Sa	Wholesale	1843	26253	1752	0
EC1792024951001	Quito	Compania Promotora Inmobiliaria Carlos Reyes & Asociados Cia. Ltda.	Wholesale	1832	0	1752	0	Mr Mauricio Xavier Reyes Toscano, Mrs Adriana Elizabeth Reyes Toscano, Mrs Veronica Del Carmen Reyes Toscano, Mrs Ximena Catalina Reyes Toscano, Toscano Ortega Gloria Argentina De Los Dolores	EC
EC1792042895001	Quito	Costa Y Sierra Compania De Alimentos Y Comidas Comalimsa S.A.	Wholesale	1830	0	1752	0
EC1790014444001	Quito	Industria Plastica Sa Inplasa	Wholesale	1826	0	1752	0
EC1790608840001	Quito	Importadora Comercial Ochoa S.A. Ico Internacional	Wholesale	1824	0	1752	0
EC17556	Recoleta	Coopad	Wholesale	1802	16061	1752	0
EC0992439297001	Guayaquil	Karunkar S.A.	Wholesale	1799	0	1752	0
EC1791977300001	Quito	Aceros Emanuel Vewilbe S.A.	Wholesale	1785	0	1752	2	Mr Fernando Velasco Calvopina Wilson, Mrs Elizabeth Filomena Pilpe Rodas	EC
EC1792398789001	Quito	Sfm Facility Servicios Complementarios S.A.	Services	1784	0	1752	0
EC0992325143001	Guayaquil	Infinitycompany S.A.	Services	1770	0	1752	0
EC0791702496001	Machala	Fruta Rica Frutaric S.A.	Services	1768	0	1752	0
EC0992623411001	Guayaquil	Ustinov S.A.	Services	1757	0	1752	0
EC1792127750001	Quito	Calocastro & Publicidad S.A.	Services	1754	0	1752	0
EC1790438163001	Quito	Consultora De Ingenieria Estudios Y Perforacion De Suelos Cieper Cl	Services	1751	0	600	0	Mr Eduardo Toala Leon Fabian, Mr Leonardo Castro Naranjo, Mrs Cristina Castro Ayala Paola	EC
EC1792076749001	Quito	Filmeikers S.A.	Services	1749	0	600	0
EC1791894731001	Quito	Integra Comunicaciones Cia. Ltda.	Services	1747	0	600	0
EC1791739116001	Quito	Htm High Tech Manufacturing Cia. Ltda	Services	1738	0	600	0
EC1091716824001	Ibarra	Conectacel Cia. Ltda.	Services	1737	0	600	0
EC2090004568001	Santa Rosa Con La Isla Baltra	Serinatura S.A.	Services	1733	0	600	0
EC1791875834001	Quito	Adeccobusiness S.A.	Services	1729	0	600	404	Adeccoiberia S.A., Mr Antonio Oliver Lorente Blas	ES,EC
EC1791769708001	Quito	Eli Lilly Interamerica Inc.	Services	1728	0	600	0
EC0992537361001	Guayaquil	Publimarstar S.A.	Services	1727	0	600	0
EC0992259221001	Guayaquil	Navesur C. Ltda.	Services	1712	0	600	0
EC1791825292001	Quito	Expeditiontours S.A.	Services	1703	0	600	0
EC1792184134001	Guayaquil	Black & Decker Del Ecuador S.A.	Services	1702	0	600	663	Stanley Black & Decker, Inc.	US
EC1790332659001	Quito	Zoldan & Zoldan Cia. Ltda.	Services	1702	0	600	0	Mr Abraham Zoldan Pasternak, Mr Elias Zoldan Fogel, Mr Isaac Zoldan Pasternak, Mr Moises Jacobo Zoldan Pasternak	EC
EC0991457356001	Guayaquil	Andipuerto Guayaquil S.A.	Services	1685	0	600	3	Almacenadora Centroamericana S.A. De C.V., Andigrain S.A., Andinave Sa	SV,EC
EC1792174465001	Quito	Uniarmasot Cia. Ltda.	Services	1685	0	600	0
EC1792505178001	Quito	Deccoulsan S.A.	Services	1677	0	600	0
EC1791230272001	Quito	Stimm Soluciones Tecnologicas Inteligentes Para Mercado Movil Cia. Ltda.	Wholesale	1672	0	600	683	Brightstar International Corp, Brightstar Venture Llc, Fideicomiso Mercantil En Garantia Brightstar Motorola S.A.	EC,US
EC0992662727001	Guayaquil	Markatention S.A.	Wholesale	1669	0	600	0
EC0992852216001	Guayaquil	Nedolcor S.A.	Wholesale	1668	0	600	0
EC0791717345001	Machala	Celplus S.A.	Wholesale	1666	0	600	0
EC1792235952001	Quito	Avisoriaweb S.A.	Wholesale	1661	0	600	9	Latam Autos Limited	AU
EC1792052580001	Quito	Cogarep Cia. Ltda.	Wholesale	1647	0	600	0
EC0992455454001	Guayaquil	Rfs S.A. Road Feeder Services	Wholesale	1645	0	600	0
EC1792265134001	Quito	Alimentos Y Negocios Asociados Ayna Cia. Ltda.	Wholesale	1643	0	600	0
EC0992441534001	Guayaquil	Citikold S.A.	Wholesale	1642	0	600	0
EC1791435354001	Quito	Hpi Human Perspectives International Cia. Ltda.	Wholesale	1627	0	600	0
EC1790040968001	Quito	Industrial Danec Sa	Wholesale	1622	0	600	0	Danec Enterprises Llc, Danec Group Llc, Danec Holdings Llc, Danec Investments Llc, Danec Ventures Llc, Disanco Enterprises Llc, Disanco Group Llc, Disanco Holdings Llc, Disanco Investments Llc, Disanco Ventures Llc	US
EC1090051721001	Ibarra	Empresa Electrica Regional Norte Sa Emelnorte	Services	1617	0	600	0
EC0991375430001	Guayaquil	Corral Rosales Carmigniani Perez C. L.	Services	1607	0	600	0
EC1791265483001	Quito	Travelecuador Cia. Ltda.	Services	1592	0	600	0
EC1791942760001	Quito	Ingenieria Para El Desarrollo Acurio Y Asociados S.A.	Services	1586	0	600	2	Mr Fausto Fernando Acurio Acurio, Mr Julio Cesar Acosta Ponce, Mrs Elizabeth Virginia Acurio Acurio	EC
EC0991463275001	Guayaquil	Galarzauto S.A.	Services	1585	0	600	0
EC1792257042001	Quito	Conskumyi Ecuador S.A.	Services	1554	0	600	0
EC1791431960001	Conocoto	Campustrekking Cia. Ltda.	Services	1540	0	600	0
EC1791918142001	Quito	Rinter S.A.	Services	1537	0	600	0
EC0992614838001	Guayaquil	Guayaquil Chang Jiang Shoes S.A.	Services	1530	0	600	0
EC1790646882001	Quito	Rincon La Ronda Servicios Y Banquetes S.A.	Services	1530	0	600	0
EC1790151506001	Quito	Constructora Importadora Alvarez Burbano S.A.	Services	1526	2950	600	0	Fondo Colectivo De Inversion Fondo Pais Ecuador, Mr Alfredo Baccichetto De Biasi, Mr Carlos Alberto Alvarez Jaramillo, Mr Cesar Eduardo Alvarez Palacio, Mr Francisco Javier Baca Bonilla, Mr Francisco Xavier Alvarez Palacio, Mr Jorge Esteban Alvarez Palacio, Mr Jose Luis Alvarez Palacio, Mr Juan Andres Alvarez Jaramillo, Mr Pablo Esteban Alvarez Jaramillo, Mrs Marjorie Eliana Alvarez Palacio, Mrs Marjorie Elizabeth Palacio Queirolo, Mrs Soledad Gisela Jaramillo Subia	IT,EC
EC1792291593001	Quito	Agricola Agrotati Cia. Ltda.	Services	1525	0	600	0
EC1791861299001	Quito	Ortopedicos Futuro C.A.	Services	1525	0	600	0
EC1792349087001	Quito	Futbol Factory Futfact Cia. Ltda.	Services	1515	0	600	0
EC0992537663001	Guayaquil	Plastistar S.A.	Services	1514	0	600	0
EC0991275703001	Guayaquil	Representaciones Jamsa S.A.	Services	1513	0	600	0
EC0990158916001	Guayaquil	Inmobiliaria San Jorge Sa	Services	1511	0	600	0
EC0992809620001	Guayaquil	Industrias Galarza & Gonzalez S.A. G&Gjeans	Services	1509	0	600	0
EC2290316491001	Quito	Amazonservice Cia. Ltda.	Services	1505	0	600	0
EC0992537132001	Guayaquil	Servyciconti S.A.	Services	1499	0	600	0
EC0491502916001	Tulcan	Servicios Profesionales De Ingenieria Civil Consultoria Y Fiscalizacion Sepincof Cia. Ltda.	Services	1497	0	600	0
EC1792349524001	Conocoto	Comferval Cia. Ltda.	Services	1494	0	600	0
EC1791812255001	Quito	Dekorando Cabinas Para Bano Cia. Ltda	Services	1491	0	600	0
EC1791843649001	Quito	Paracamiones Cia. Ltda.	Services	1491	0	600	0
EC0992306564001	Guayaquil	Gusnobe S.A.	Services	1490	0	600	0
EC1792479339001	Quito	Imberlumber Del Ecuador Cia. Ltda	Services	1489	0	600	0
EC0992478721001	Guayaquil	Comdamet S.A.	Services	1486	0	600	2	Bolaãœãžãœã“O Cedeãœãžãœã“O Kelvi Alanades, Mr Jairo Roberth Penafiel Mosquera, Mrs Jessica Fabricia Penafiel Mosquera	EC
EC1790484793001	Quito	Bustamante Y Bustamante Cia. Ltda.	Services	1479	0	600	0	Mr Jose Maria Bustamante Zaldumbide, Mr Jose Rafael Bustamante Espinosa, Mr Juan Carlos Bustamante Calisto, Mr Roque Bernardo Bustamante Espinosa	EC
EC0992287500001	Guayaquil	Importadora Comercial Maxima S.A. Impormaxima	Services	1474	0	600	0
EC1792194849001	Sangolqui	Journeyfleet Cia. Ltda.	Services	1465	0	600	0
EC1790457303001	Quito	Centro Medico Quirurgico Pichincha Cenmep Sa	Services	1463	0	600	0
EC0190349551001	Cuenca	Constructora Lopez Guillen Cia. Ltda.	Services	1460	0	600	0	Mr Diego Andres Lopez Moreno, Mr Felipe Alejandro Lopez Moreno, Mr Marco Abdon Lopez Guillen, Mr Marco Nicolas Lopez Moreno	EC
EC1790992748001	Quito	Decortinas Decoracion Y Cortinas Cia. Ltda.	Services	1449	0	600	0
EC20731	Duran	Cooperativa De Ahorro Y Credito La Dolorosa	Services	1444	12201	600	0
EC1790883930001	Quito	Andolas Cia. Ltda.	Services	1433	0	600	0
EC0992537612001	Guayaquil	Marypescorp S.A.	Services	1431	0	600	0
EC1191736008001	Loja	Comercializadora Herrera Roman Cia. Ltda.	Services	1423	0	600	2	Mr Carlos Rodrigo Herrera Salcedo, Mrs Gloria Isabel Abendano Salcedo	EC
EC1792133270001	Quito	Industria Comercial Plastica Mendieta Carrillo Cia. Ltda.	Services	1412	0	600	0
EC1792339375001	Quito	Ecosonido Cia. Ltda.	Services	1409	0	600	0
EC20755	Santa Ana	Cooperativa De Ahorro Y Credito Santa Ana Ltd	Services	1408	12079	600	0
EC0992204206001	Guayaquil	Pdv Ecuador S.A.	Manufacturing	1402	0	600	2	Commercit S.A., Tradecal S.A	VE
EC1792270693001	Quito	Importadora Vinoterra S.A.	Manufacturing	1395	0	600	0
EC0990778221001	Guayaquil	Asesores Y Consejeros Aconsec Cia.Ltda.	Manufacturing	1394	0	600	2	Mr Cesar Coronel Ortega, Mr Coronel Jones Cesar Irwin	EC
EC20768	Guayaquil	Cooperativa De Ahorro Y Credito 9 De Octubre Ltda	Manufacturing	1394	11674	600	0
EC1792254256001	Quito	Dystarecuador Cia. Ltda.	Manufacturing	1394	0	600	0
EC0990137331001	Guayaquil	Navecuador S.A.	Manufacturing	1391	0	600	0	Ankari S.A., Farimar S.A., Nimaro Sa, Peal S.A, Rideyca S.A.	EC
EC1791115732001	Puerto Ayora	Internacional De Viajes Y Turismo Cretertur Cia. Ltda.	Manufacturing	1388	0	600	0
EC0992663650001	Guayaquil	Afines Y Comercio Aficomsa S.A.	Manufacturing	1385	0	600	0
EC0992600888001	Guayaquil	Gateimport S.A.	Manufacturing	1381	0	600	0
EC0990780773001	Cuenca	Sociedad Financiera Del Austro S.A.	Manufacturing	1379	22634	600	0
